{
  "catalogVersion": 1,
  "generatedAtUtc": "2026-10-23T13:12:17Z",
  "adapters": [
    {
      "adapterId": "space-engineers",
      "slug": "space-engineers",
      "displayName": "Space Engineers",
      "currentVersion": "1.0.2",
      "releases": [
        {
          "descriptorVersion": 1,
          "adapterId": "space-engineers",
          "slug": "space-engineers",
          "adapterVersion": "1.0.2",
          "sdkVersion": "1.5.0",
          "channel": "stable",
          "publishedAtUtc": "2026-10-23T13:09:12Z",
          "source": {
            "tag": "adapters/space-engineers/v1.0.2",
            "commit": "8ab8f724bb0e6dd47787b40daf5218024a707b57"
          },
          "package": {
            "fileName": "kontrol-adapter-space-engineers-1.0.2-win-x64.zip",
            "sha256": "5693CA6A9AA5397518BD021EC8F2A2EEF8AFCBB2D35C85BC799941FCD64E5AF1",
            "url": "https://komandio-labs.github.io/kontrol-adapters/packages/space-engineers/1.0.2/kontrol-adapter-space-engineers-1.0.2-win-x64.zip",
            "architecture": "x64"
          },
          "gameProductVersion": "1.210.014",
          "gameBuildIdentity": {
            "platform": "steam",
            "platformAppId": "244850",
            "platformBuildId": "24675677",
            "productVersion": "1.210.014",
            "isProductVersionMeaningful": true,
            "fingerprintBuildId": null
          },
          "assemblies": {
            "VRage.dll": {
              "sha256": "EC2410B3D916ADBD7404C3082CCC25A70C8BAEC89BACB57001C67597068E24CA",
              "fileVersion": "1.0.0.0"
            },
            "VRage.Game.dll": {
              "sha256": "F0970C2B60335F7690E158A485CD528703717C8C5002F2713556E04F09C508E1",
              "fileVersion": "1.0.0.0"
            },
            "VRage.Math.dll": {
              "sha256": "953ED575327FFEC5A72BAF13C893843C26F7D248CD1ECE1372EC34D650618F1C",
              "fileVersion": "1.0.0.0"
            },
            "Sandbox.Game.dll": {
              "sha256": "DE04E9162BCF87FC07CEC377213D99533BCFE1C34C9E1E2231168144C9D67EDF",
              "fileVersion": "0.1.1"
            }
          },
          "verifiedGameVersions": [
            "1.210.014"
          ],
          "signature": "60F\u002BwIuwQDhexWILpq6Jdkt6HBX9sgEmYbZxUbF1/kfvZN7kNoQ1uV5Q0fSA7PwGEDMhsdZu6N8Qqo\u002BwxH0EBg==",
          "status": "current"
        },
        {
          "descriptorVersion": 1,
          "adapterId": "space-engineers",
          "slug": "space-engineers",
          "adapterVersion": "1.0.1",
          "sdkVersion": "1.4.0",
          "channel": "stable",
          "publishedAtUtc": "2026-09-27T10:08:10Z",
          "source": {
            "tag": "adapters/space-engineers/v1.0.1",
            "commit": "c10b9c434c92b66fd413a040d95ff2adab4f7ae6"
          },
          "package": {
            "fileName": "kontrol-adapter-space-engineers-1.0.1-win-x64.zip",
            "sha256": "E3A1E14510C16D0F506765C3264D99F98DCB7523C60C59A272A9CAEEECD73561",
            "url": "https://komandio-labs.github.io/kontrol-adapters/packages/space-engineers/1.0.1/kontrol-adapter-space-engineers-1.0.1-win-x64.zip",
            "architecture": "x64"
          },
          "gameProductVersion": "steam-build-24675677",
          "gameBuildIdentity": {
            "platform": "steam",
            "platformAppId": "244850",
            "platformBuildId": "24675677",
            "productVersion": null,
            "isProductVersionMeaningful": false,
            "fingerprintBuildId": null
          },
          "assemblies": {
            "VRage.dll": {
              "sha256": "EC2410B3D916ADBD7404C3082CCC25A70C8BAEC89BACB57001C67597068E24CA",
              "fileVersion": "1.0.0.0"
            },
            "VRage.Game.dll": {
              "sha256": "F0970C2B60335F7690E158A485CD528703717C8C5002F2713556E04F09C508E1",
              "fileVersion": "1.0.0.0"
            },
            "VRage.Math.dll": {
              "sha256": "953ED575327FFEC5A72BAF13C893843C26F7D248CD1ECE1372EC34D650618F1C",
              "fileVersion": "1.0.0.0"
            },
            "Sandbox.Game.dll": {
              "sha256": "DE04E9162BCF87FC07CEC377213D99533BCFE1C34C9E1E2231168144C9D67EDF",
              "fileVersion": "0.1.1"
            }
          },
          "verifiedGameVersions": [
            "steam-build-24675677"
          ],
          "signature": "Nl37Ms8F0EQk7t6szG1CdO03E/KaO4e04IBH\u002Bo4cauFj335\u002BkNVIte9OOFkurxjmWFuh5fuMS8E\u002BxZEVZ0dGRg==",
          "status": "superseded"
        },
        {
          "descriptorVersion": 1,
          "adapterId": "space-engineers",
          "slug": "space-engineers",
          "adapterVersion": "1.0.0",
          "sdkVersion": "1.4.0",
          "channel": "stable",
          "publishedAtUtc": "2026-09-13T19:18:20Z",
          "source": {
            "tag": "adapters/space-engineers/v1.0.0",
            "commit": "d780bdeebf2fc917ab4373fba409f9f8c51d8bed"
          },
          "package": {
            "fileName": "kontrol-adapter-space-engineers-1.0.0-win-x64.zip",
            "sha256": "B8F15EDA25712039A95B63052FD9502A02D97E9F380A52CFC79946E019DC0D40",
            "url": "https://komandio-labs.github.io/kontrol-adapters/packages/space-engineers/1.0.0/kontrol-adapter-space-engineers-1.0.0-win-x64.zip",
            "architecture": "x64"
          },
          "gameProductVersion": "steam-build-24675677",
          "assemblies": {
            "VRage.dll": {
              "sha256": "EC2410B3D916ADBD7404C3082CCC25A70C8BAEC89BACB57001C67597068E24CA",
              "fileVersion": "1.0.0.0"
            },
            "VRage.Game.dll": {
              "sha256": "F0970C2B60335F7690E158A485CD528703717C8C5002F2713556E04F09C508E1",
              "fileVersion": "1.0.0.0"
            },
            "VRage.Math.dll": {
              "sha256": "953ED575327FFEC5A72BAF13C893843C26F7D248CD1ECE1372EC34D650618F1C",
              "fileVersion": "1.0.0.0"
            },
            "Sandbox.Game.dll": {
              "sha256": "DE04E9162BCF87FC07CEC377213D99533BCFE1C34C9E1E2231168144C9D67EDF",
              "fileVersion": "0.1.1"
            }
          },
          "verifiedGameVersions": [
            "steam-build-24675677"
          ],
          "signature": "FBmWqgc\u002BqIWxppzfG9X\u002Bq7p40le6/Q6HCNxwnQBlAvLkiKifp34CmQTXY/XbGo6zmZx89GdEBEVenLo17449Wg==",
          "status": "superseded"
        }
      ]
    },
    {
      "adapterId": "space-engineers-2",
      "slug": "space-engineers-2",
      "displayName": "Space Engineers 2",
      "currentVersion": "0.4.2",
      "releases": [
        {
          "descriptorVersion": 1,
          "adapterId": "space-engineers-2",
          "slug": "space-engineers-2",
          "adapterVersion": "0.4.2",
          "sdkVersion": "1.5.0",
          "channel": "stable",
          "publishedAtUtc": "2026-10-23T13:12:15Z",
          "source": {
            "tag": "adapters/space-engineers-2/v0.4.2",
            "commit": "8ab8f724bb0e6dd47787b40daf5218024a707b57"
          },
          "package": {
            "fileName": "kontrol-adapter-space-engineers-2-0.4.2-win-x64.zip",
            "sha256": "67F78679A909C3100811874ABBB61683B952367756D0B524BC06B181AE58AA0E",
            "url": "https://komandio-labs.github.io/kontrol-adapters/packages/space-engineers-2/0.4.2/kontrol-adapter-space-engineers-2-0.4.2-win-x64.zip",
            "architecture": "x64"
          },
          "gameProductVersion": "4.0.0.3159",
          "gameBuildIdentity": {
            "platform": "steam",
            "platformAppId": "1133870",
            "platformBuildId": "26128838",
            "productVersion": "4.0.0.3159",
            "isProductVersionMeaningful": true,
            "fingerprintBuildId": null
          },
          "assemblies": {
            "Game2.Client.dll": {
              "sha256": "95AD3F3920CEFA560236BB35B30515A5724B7588D8FAA249631F4089C1D51ABD",
              "fileVersion": "4.0.0.3159"
            },
            "VRage.Core.dll": {
              "sha256": "6CF0F8D2B7A2966EB4C9E6CCB1DC434B9CB5FE4BEE3BDA222B4D90D3C5A78013",
              "fileVersion": "4.0.0.3159"
            },
            "VRage.Library.dll": {
              "sha256": "0538F2ECB38E2BAC0D29CB3C533A0C3FFFB1A1C33D9C774C970D7D0576D2BB4C",
              "fileVersion": "4.0.0.3159"
            }
          },
          "verifiedGameVersions": [
            "4.0.0.3159"
          ],
          "signature": "sFplM2Ksj3YN2vjbtb0QaDswBCgmFsPDV3T3x7yHR01N\u002BYVwqMxiU4gGjls8kbhjCMD5LG4rPsv4gGiRdHWjyQ==",
          "status": "current"
        },
        {
          "descriptorVersion": 1,
          "adapterId": "space-engineers-2",
          "slug": "space-engineers-2",
          "adapterVersion": "0.4.1",
          "sdkVersion": "1.4.0",
          "channel": "stable",
          "publishedAtUtc": "2026-09-27T10:08:51Z",
          "source": {
            "tag": "adapters/space-engineers-2/v0.4.1",
            "commit": "c10b9c434c92b66fd413a040d95ff2adab4f7ae6"
          },
          "package": {
            "fileName": "kontrol-adapter-space-engineers-2-0.4.1-win-x64.zip",
            "sha256": "C9FC4285A8C1CFC91E957D6318FF15410739A4F6B5626E7F6F850F8C5FBAE1E3",
            "url": "https://komandio-labs.github.io/kontrol-adapters/packages/space-engineers-2/0.4.1/kontrol-adapter-space-engineers-2-0.4.1-win-x64.zip",
            "architecture": "x64"
          },
          "gameProductVersion": "2.4.0.95",
          "gameBuildIdentity": {
            "platform": "steam",
            "platformAppId": "1133870",
            "platformBuildId": "24993846",
            "productVersion": "2.4.0.95",
            "isProductVersionMeaningful": true,
            "fingerprintBuildId": null
          },
          "assemblies": {
            "Game2.Client.dll": {
              "sha256": "FDCD1C1EB01433BE994C87893A88F720325BF93C1E797930D79859ED664BB9BA",
              "fileVersion": "2.4.0.95"
            },